{
  "company_id": "U_37452",
  "news_id": "9bfb602e317f62a40ab4bd588e14178869a9ee317e02572c6083315e6f4fd66c",
  "status": "ready",
  "news_summary": "Аналитики прогнозируют сохранение ключевой ставки Банка России на уровне 14% на ближайшем заседании. Эксперты также обсуждают возможный пересмотр прогнозов ЦБ по инфляции.",
  "short_answer": "Сохранение высокой ставки может повлиять на стоимость кредитов и лизинга, которые используются компанией, однако точное влияние не определено из-за отсутствия данных о структуре долга.",
  "classification": {
    "business_relevant": true,
    "topics": [
      "financial_markets",
      "regulation"
    ],
    "importance": "medium",
    "importance_method": "classifier",
    "importance_reason": "Компания использует кредиты и лизинг, что создает косвенную связь с решениями по ключевой ставке, но финансовые условия заимствований в данных не указаны."
  },
  "evidence": {
    "news_summary": [
      {
        "source_id": "news:9bfb602e317f62a40ab4bd588e14178869a9ee317e02572c6083315e6f4fd66c",
        "quote": "INTERFAX.RU - Аналитики единогласно прогнозируют сохранение ключевой ставки ЦБ РФ в ближайшую пятницу на уровне 14%."
      },
      {
        "source_id": "news:9bfb602e317f62a40ab4bd588e14178869a9ee317e02572c6083315e6f4fd66c",
        "quote": "Они ждут, что Банк России повысит прогноз по инфляции на 2026 год с 6-7% до 6,5-7,5%, на 2027 год - с 4% до 4-4,5%."
      }
    ],
    "short_answer": [
      {
        "source_id": "company:U_37452:okved_names",
        "quote": "[\"Торговля оптовая бытовыми электротоварами\"]"
      },
      {
        "source_id": "company:U_37452:banking_services",
        "quote": "[\"cash_register\", \"credit\", \"leasing\", \"deposit\", \"payroll\"]"
      },
      {
        "source_id": "news:9bfb602e317f62a40ab4bd588e14178869a9ee317e02572c6083315e6f4fd66c",
        "quote": "Аналитики единогласно прогнозируют сохранение ключевой ставки ЦБ РФ в ближайшую пятницу на уровне 14%."
      }
    ],
    "importance": [
      {
        "source_id": "company:U_37452:okved_names",
        "quote": "[\"Торговля оптовая бытовыми электротоварами\"]"
      },
      {
        "source_id": "company:U_37452:banking_services",
        "quote": "[\"cash_register\", \"credit\", \"leasing\", \"deposit\", \"payroll\"]"
      },
      {
        "source_id": "news:9bfb602e317f62a40ab4bd588e14178869a9ee317e02572c6083315e6f4fd66c",
        "quote": "Аналитики единогласно прогнозируют сохранение ключевой ставки ЦБ РФ в ближайшую пятницу на уровне 14%."
      }
    ]
  }
}
