[
  {
    "company_id": "U_128194",
    "news_id": "6fd817b6b18a3c411d8fd211415892665b9b818b72cc3d64c13f61fe937b10b7",
    "status": "ready",
    "news_summary": "Минпромторг РФ планирует рассмотреть варианты увеличения финансирования программ льготного автокредитования и автолизинга в рамках бюджета на 2027–2029 гг.",
    "short_answer": "Увеличение господдержки автокредитования может косвенно поддержать спрос на автомобили, что потенциально влияет на рынок автозапчастей, где работает компания, однако прямая связь не установлена.",
    "classification": {
      "business_relevant": true,
      "topics": [
        "automotive",
        "regulation",
        "other_business"
      ],
      "importance": "low",
      "importance_method": "classifier",
      "importance_reason": "Компания занимается оптовой торговлей автодеталями, и рост спроса на транспорт из-за льготного кредитования может косвенно отразиться на рынке запчастей."
    },
    "evidence": {
      "news_summary": [
        {
          "source_id": "news:6fd817b6b18a3c411d8fd211415892665b9b818b72cc3d64c13f61fe937b10b7",
          "quote": "предложит варианты увеличения финансирования программ льготного автокредитования и автолизинга."
        }
      ],
      "short_answer": [
        {
          "source_id": "news:6fd817b6b18a3c411d8fd211415892665b9b818b72cc3d64c13f61fe937b10b7",
          "quote": "предложит варианты увеличения финансирования программ льготного автокредитования и автолизинга."
        },
        {
          "source_id": "company:U_128194:okved_names",
          "quote": "Торговля оптовая автомобильными деталями, узлами и принадлежностями, кроме деятельности агентов"
        },
        {
          "source_id": "metric:U_128194:top_okved",
          "quote": "Торговля оптовая и розничная автотранспортными средствами и мотоциклами"
        },
        {
          "source_id": "metric:U_128194:counterparties",
          "quote": "Роли покупателя/поставщика и причинная связь с новостью не установлены."
        }
      ],
      "importance": [
        {
          "source_id": "news:6fd817b6b18a3c411d8fd211415892665b9b818b72cc3d64c13f61fe937b10b7",
          "quote": "предложит варианты увеличения финансирования программ льготного автокредитования и автолизинга."
        },
        {
          "source_id": "company:U_128194:okved_names",
          "quote": "Торговля оптовая автомобильными деталями, узлами и принадлежностями, кроме деятельности агентов"
        },
        {
          "source_id": "metric:U_128194:top_okved",
          "quote": "Торговля оптовая и розничная автотранспортными средствами и мотоциклами"
        },
        {
          "source_id": "metric:U_128194:counterparties",
          "quote": "Роли покупателя/поставщика и причинная связь с новостью не установлены."
        }
      ]
    }
  },
  {
    "company_id": "U_37452",
    "news_id": "9bfb602e317f62a40ab4bd588e14178869a9ee317e02572c6083315e6f4fd66c",
    "status": "ready",
    "news_summary": "Аналитики единогласно прогнозируют сохранение ключевой ставки ЦБ РФ на уровне 14% на ближайшем заседании.",
    "short_answer": "Сохранение высокой ставки может означать, что стоимость кредитования и лизинга для компании U_37452 останется высокой, что потенциально влияет на её финансирование.",
    "classification": {
      "business_relevant": true,
      "topics": [
        "financial_markets",
        "regulation"
      ],
      "importance": "low",
      "importance_method": "classifier",
      "importance_reason": "Компания использует кредит и лизинг, а сохранение ставки 14% может поддерживать высокую стоимость этих инструментов."
    },
    "evidence": {
      "news_summary": [
        {
          "source_id": "news:9bfb602e317f62a40ab4bd588e14178869a9ee317e02572c6083315e6f4fd66c",
          "quote": "Аналитики единогласно прогнозируют сохранение ключевой ставки ЦБ РФ в ближайшую пятницу на уровне 14%."
        },
        {
          "source_id": "news:9bfb602e317f62a40ab4bd588e14178869a9ee317e02572c6083315e6f4fd66c",
          "quote": "Эксперты расходятся только в оценке тона сигнала: останется он нейтральным или будет ужесточен."
        }
      ],
      "short_answer": [
        {
          "source_id": "news:9bfb602e317f62a40ab4bd588e14178869a9ee317e02572c6083315e6f4fd66c",
          "quote": "Аналитики единогласно прогнозируют сохранение ключевой ставки ЦБ РФ в ближайшую пятницу на уровне 14%."
        },
        {
          "source_id": "news:9bfb602e317f62a40ab4bd588e14178869a9ee317e02572c6083315e6f4fd66c",
          "quote": "Эксперты расходятся только в оценке тона сигнала: останется он нейтральным или будет ужесточен."
        },
        {
          "source_id": "company:U_37452:banking_services",
          "quote": "credit"
        },
        {
          "source_id": "company:U_37452:banking_services",
          "quote": "leasing"
        }
      ],
      "importance": [
        {
          "source_id": "news:9bfb602e317f62a40ab4bd588e14178869a9ee317e02572c6083315e6f4fd66c",
          "quote": "Аналитики единогласно прогнозируют сохранение ключевой ставки ЦБ РФ в ближайшую пятницу на уровне 14%."
        },
        {
          "source_id": "news:9bfb602e317f62a40ab4bd588e14178869a9ee317e02572c6083315e6f4fd66c",
          "quote": "Эксперты расходятся только в оценке тона сигнала: останется он нейтральным или будет ужесточен."
        },
        {
          "source_id": "company:U_37452:banking_services",
          "quote": "credit"
        },
        {
          "source_id": "company:U_37452:banking_services",
          "quote": "leasing"
        }
      ]
    }
  },
  {
    "company_id": "U_46911",
    "news_id": "1056dce3cfa282c8aee1ecd173c5273091e4715beda0b3930c733a3261c46b2e",
    "status": "ready",
    "news_summary": "Стоимость аренды судов для перевозки сырья из Новороссийска и Приморска достигла исторического максимума в $27–48 за баррель из-за роста мировых ставок фрахта.",
    "short_answer": "Влияние на компанию не установлено. Несмотря на тематическую близость ОКВЭД 52.29 к транспортной деятельности, данных о связи компании с морскими перевозками нефти нет.",
    "classification": {
      "business_relevant": true,
      "topics": [
        "energy",
        "logistics"
      ],
      "importance": "low",
      "importance_method": "classifier",
      "importance_reason": "Связь слабая: ОКВЭД компании (52.29) относится к вспомогательной деятельности в перевозках, но нет подтверждения участия в морском фрахте нефти."
    },
    "evidence": {
      "news_summary": [
        {
          "source_id": "news:1056dce3cfa282c8aee1ecd173c5273091e4715beda0b3930c733a3261c46b2e",
          "quote": "По данным Argus, аренда судов для перевозки сырья из Новороссийска и Приморска подорожала до максимума за историю наблюдений — $27–48 за баррель."
        },
        {
          "source_id": "news:1056dce3cfa282c8aee1ecd173c5273091e4715beda0b3930c733a3261c46b2e",
          "quote": "Рост мировых ставок фрахта и сохраняющиеся риски для судоходства разогнали стоимость транспортировки российской нефти."
        }
      ],
      "short_answer": [
        {
          "source_id": "company:U_46911:okved_names",
          "quote": "[\"Деятельность вспомогательная прочая, связанная с перевозками\"]"
        },
        {
          "source_id": "news:1056dce3cfa282c8aee1ecd173c5273091e4715beda0b3930c733a3261c46b2e",
          "quote": "Рост мировых ставок фрахта и сохраняющиеся риски для судоходства разогнали стоимость транспортировки российской нефти."
        },
        {
          "source_id": "metric:U_46911:top_okved",
          "quote": "{\"okved_class\": \"52\", \"okved_name\": \"Складское хозяйство и вспомогательная транспортная деятельность\", \"counterparties_count\": 53, \"amount_rub\": 415342000, \"share_pct\": 13.59, \"top_codes\": [{\"okved_code\": \"52.29\", \"okved_name\": \"Деятельность вспомогательная прочая, связанная с перевозками\", \"counterparties_count\": 43, \"amount_rub\": 409056000, \"share_pct\": 13.39}"
        }
      ],
      "importance": [
        {
          "source_id": "company:U_46911:okved_names",
          "quote": "[\"Деятельность вспомогательная прочая, связанная с перевозками\"]"
        },
        {
          "source_id": "news:1056dce3cfa282c8aee1ecd173c5273091e4715beda0b3930c733a3261c46b2e",
          "quote": "Рост мировых ставок фрахта и сохраняющиеся риски для судоходства разогнали стоимость транспортировки российской нефти."
        },
        {
          "source_id": "metric:U_46911:top_okved",
          "quote": "{\"okved_class\": \"52\", \"okved_name\": \"Складское хозяйство и вспомогательная транспортная деятельность\", \"counterparties_count\": 53, \"amount_rub\": 415342000, \"share_pct\": 13.59, \"top_codes\": [{\"okved_code\": \"52.29\", \"okved_name\": \"Деятельность вспомогательная прочая, связанная с перевозками\", \"counterparties_count\": 43, \"amount_rub\": 409056000, \"share_pct\": 13.39}"
        }
      ]
    }
  }
]
